ad_id,raw_text,concept,trigger,driver_persona,format,hook_type,rationale,error_message
1,"My electric bill keeps climbing, so I switched to this smart thermostat and cut costs by 30% in two weeks. Here's how easy it was to install.",Saving money on utilities,Recent spike in household bills,General consumer,Tutorial walkthrough,Bold claim with quantified benefit,"Heuristic labels based on detected keywords for concept=Saving money on utilities, trigger=Recent spike in household bills, persona=General consumer, format=Tutorial walkthrough, hook=Bold claim with quantified benefit.",
2,"It's 6 AM, the baby is crying, and coffee is cold again—until I tried this self-heating mug that keeps every sip hot while I juggle mom life.",Convenience and self-care,Daily morning struggle,Busy mom juggling tasks,UGC testimonial,Direct statement,"Heuristic labels based on detected keywords for concept=Convenience and self-care, trigger=Daily morning struggle, persona=Busy mom juggling tasks, format=UGC testimonial, hook=Direct statement.",
3,"New year, new job. I needed a laptop that loads everything instantly—watch me unbox this ultra-light model and boot it in 5 seconds.",Performance and speed,New Year reset,Young professional upgrading gear,Unboxing demo,Time-based proof,"Heuristic labels based on detected keywords for concept=Performance and speed, trigger=New Year reset, persona=Young professional upgrading gear, format=Unboxing demo, hook=Time-based proof.",
4,Dermatologists hate that I ditched heavy foundations. This green-screen demo shows how a tinted serum blurred my pores in one week.,Beauty and skin health,General need state,General consumer,Green screen demo,Contrarian claim,"Heuristic labels based on detected keywords for concept=Beauty and skin health, trigger=General need state, persona=General consumer, format=Green screen demo, hook=Contrarian claim.",
5,"You're scrolling past another fitness ad, but ask yourself: what if 10 minutes a day could fix your posture? Here's the routine I used.",Habit formation and wellness,Ongoing social feed browsing,Desk worker worried about posture,Routine tutorial,Rhetorical question,"Heuristic labels based on detected keywords for concept=Habit formation and wellness, trigger=Ongoing social feed browsing, persona=Desk worker worried about posture, format=Routine tutorial, hook=Rhetorical question.",
